<Medpc_Configuration HardwareSchemaVersion="1.0" xmlns:xsi="http://www.w3.org/2001/XMLSchema-instance" xsi:noNamespaceSchemaLocation="MedPCConfiguration.xsd">
  <Configuration_Types>
    <Hardware>
      <Overall>
        <Resolution>10</Resolution>
        <Rack_Count>1</Rack_Count>
        <InportMin>780</InportMin>
        <InportMax>783</InportMax>
        <NumBoxes>4</NumBoxes>
      </Overall>
      <Racks>
        <Rack>
          <RackNumber>1</RackNumber>
          <Slot_Count>17</Slot_Count>
          <TestPort>
            <Port>780</Port>
            <Offset>-1</Offset>
          </TestPort>
          <Cards>
            <Card>
              <Model>DIG716B</Model>
              <Slot>16</Slot>
              <SecondaryCard>0</SecondaryCard>
              <InputPort>780</InputPort>
              <InportOffset>-1</InportOffset>
              <OutPort>792</OutPort>
              <OutPortOffset>0</OutPortOffset>
              <ForceUnique>-1</ForceUnique>
            </Card>
            <Card>
              <Model>DIG716B</Model>
              <Slot>15</Slot>
              <SecondaryCard>0</SecondaryCard>
              <InputPort>781</InputPort>
              <InportOffset>-1</InportOffset>
              <OutPort>792</OutPort>
              <OutPortOffset>2</OutPortOffset>
              <ForceUnique>-1</ForceUnique>
            </Card>
            <Card>
              <Model>DIG716B</Model>
              <Slot>14</Slot>
              <SecondaryCard>0</SecondaryCard>
              <InputPort>782</InputPort>
              <InportOffset>-1</InportOffset>
              <OutPort>792</OutPort>
              <OutPortOffset>4</OutPortOffset>
              <ForceUnique>-1</ForceUnique>
            </Card>
            <Card>
              <Model>DIG716B</Model>
              <Slot>13</Slot>
              <SecondaryCard>0</SecondaryCard>
              <InputPort>783</InputPort>
              <InportOffset>-1</InportOffset>
              <OutPort>792</OutPort>
              <OutPortOffset>6</OutPortOffset>
              <ForceUnique>-1</ForceUnique>
            </Card>
            <Card>
              <Model>DIG726TTL</Model>
              <Slot>12</Slot>
              <SecondaryCard>0</SecondaryCard>
              <InputPort>-1</InputPort>
              <InportOffset>-1</InportOffset>
              <OutPort>792</OutPort>
              <OutPortOffset>8</OutPortOffset>
              <ForceUnique>-1</ForceUnique>
            </Card>
          </Cards>
        </Rack>
      </Racks>
      <Boxes>
        <Box>
          <Boxnumber>1</Boxnumber>
          <Inputs>
            <Input>
              <BoxNumber>1</BoxNumber>
              <Number>01</Number>
              <Rack>1</Rack>
              <Port>780</Port>
              <Offset>-1</Offset>
              <BitNumber>1</BitNumber>
            </Input>
            <Input>
              <BoxNumber>1</BoxNumber>
              <Number>02</Number>
              <Rack>1</Rack>
              <Port>780</Port>
              <Offset>-1</Offset>
              <BitNumber>2</BitNumber>
            </Input>
            <Input>
              <BoxNumber>1</BoxNumber>
              <Number>03</Number>
              <Rack>1</Rack>
              <Port>780</Port>
              <Offset>-1</Offset>
              <BitNumber>3</BitNumber>
            </Input>
            <Input>
              <BoxNumber>1</BoxNumber>
              <Number>04</Number>
              <Rack>1</Rack>
              <Port>780</Port>
              <Offset>-1</Offset>
              <BitNumber>4</BitNumber>
            </Input>
            <Input>
              <BoxNumber>1</BoxNumber>
              <Number>05</Number>
              <Rack>1</Rack>
              <Port>780</Port>
              <Offset>-1</Offset>
              <BitNumber>5</BitNumber>
            </Input>
            <Input>
              <BoxNumber>1</BoxNumber>
              <Number>06</Number>
              <Rack>1</Rack>
              <Port>780</Port>
              <Offset>-1</Offset>
              <BitNumber>6</BitNumber>
            </Input>
            <Input>
              <BoxNumber>1</BoxNumber>
              <Number>07</Number>
              <Rack>1</Rack>
              <Port>780</Port>
              <Offset>-1</Offset>
              <BitNumber>7</BitNumber>
            </Input>
            <Input>
              <BoxNumber>1</BoxNumber>
              <Number>08</Number>
              <Rack>1</Rack>
              <Port>780</Port>
              <Offset>-1</Offset>
              <BitNumber>8</BitNumber>
            </Input>
          </Inputs>
          <Outputs>
            <Output>
              <BoxNumber>1</BoxNumber>
              <Number>01</Number>
              <Rack>1</Rack>
              <Port>792</Port>
              <Offset>0</Offset>
              <BitNumber>1</BitNumber>
            </Output>
            <Output>
              <BoxNumber>1</BoxNumber>
              <Number>02</Number>
              <Rack>1</Rack>
              <Port>792</Port>
              <Offset>0</Offset>
              <BitNumber>2</BitNumber>
            </Output>
            <Output>
              <BoxNumber>1</BoxNumber>
              <Number>03</Number>
              <Rack>1</Rack>
              <Port>792</Port>
              <Offset>0</Offset>
              <BitNumber>3</BitNumber>
            </Output>
            <Output>
              <BoxNumber>1</BoxNumber>
              <Number>04</Number>
              <Rack>1</Rack>
              <Port>792</Port>
              <Offset>0</Offset>
              <BitNumber>4</BitNumber>
            </Output>
            <Output>
              <BoxNumber>1</BoxNumber>
              <Number>05</Number>
              <Rack>1</Rack>
              <Port>792</Port>
              <Offset>0</Offset>
              <BitNumber>5</BitNumber>
            </Output>
            <Output>
              <BoxNumber>1</BoxNumber>
              <Number>06</Number>
              <Rack>1</Rack>
              <Port>792</Port>
              <Offset>0</Offset>
              <BitNumber>6</BitNumber>
            </Output>
            <Output>
              <BoxNumber>1</BoxNumber>
              <Number>07</Number>
              <Rack>1</Rack>
              <Port>792</Port>
              <Offset>0</Offset>
              <BitNumber>7</BitNumber>
            </Output>
            <Output>
              <BoxNumber>1</BoxNumber>
              <Number>08</Number>
              <Rack>1</Rack>
              <Port>792</Port>
              <Offset>0</Offset>
              <BitNumber>8</BitNumber>
            </Output>
            <Output>
              <BoxNumber>1</BoxNumber>
              <Number>09</Number>
              <Rack>1</Rack>
              <Port>792</Port>
              <Offset>0</Offset>
              <BitNumber>9</BitNumber>
            </Output>
            <Output>
              <BoxNumber>1</BoxNumber>
              <Number>10</Number>
              <Rack>1</Rack>
              <Port>792</Port>
              <Offset>0</Offset>
              <BitNumber>10</BitNumber>
            </Output>
            <Output>
              <BoxNumber>1</BoxNumber>
              <Number>11</Number>
              <Rack>1</Rack>
              <Port>792</Port>
              <Offset>0</Offset>
              <BitNumber>11</BitNumber>
            </Output>
            <Output>
              <BoxNumber>1</BoxNumber>
              <Number>12</Number>
              <Rack>1</Rack>
              <Port>792</Port>
              <Offset>0</Offset>
              <BitNumber>12</BitNumber>
            </Output>
            <Output>
              <BoxNumber>1</BoxNumber>
              <Number>13</Number>
              <Rack>1</Rack>
              <Port>792</Port>
              <Offset>0</Offset>
              <BitNumber>13</BitNumber>
            </Output>
            <Output>
              <BoxNumber>1</BoxNumber>
              <Number>14</Number>
              <Rack>1</Rack>
              <Port>792</Port>
              <Offset>0</Offset>
              <BitNumber>14</BitNumber>
            </Output>
            <Output>
              <BoxNumber>1</BoxNumber>
              <Number>15</Number>
              <Rack>1</Rack>
              <Port>792</Port>
              <Offset>0</Offset>
              <BitNumber>15</BitNumber>
            </Output>
            <Output>
              <BoxNumber>1</BoxNumber>
              <Number>16</Number>
              <Rack>1</Rack>
              <Port>792</Port>
              <Offset>0</Offset>
              <BitNumber>16</BitNumber>
            </Output>
            <Output>
              <BoxNumber>1</BoxNumber>
              <Number>17</Number>
              <Rack>1</Rack>
              <Port>792</Port>
              <Offset>8</Offset>
              <BitNumber>1</BitNumber>
            </Output>
            <Output>
              <BoxNumber>1</BoxNumber>
              <Number>18</Number>
              <Rack>1</Rack>
              <Port>792</Port>
              <Offset>8</Offset>
              <BitNumber>2</BitNumber>
            </Output>
            <Output>
              <BoxNumber>1</BoxNumber>
              <Number>19</Number>
              <Rack>1</Rack>
              <Port>792</Port>
              <Offset>8</Offset>
              <BitNumber>3</BitNumber>
            </Output>
            <Output>
              <BoxNumber>1</BoxNumber>
              <Number>20</Number>
              <Rack>1</Rack>
              <Port>792</Port>
              <Offset>8</Offset>
              <BitNumber>4</BitNumber>
            </Output>
          </Outputs>
        </Box>
        <Box>
          <Boxnumber>2</Boxnumber>
          <Inputs>